scale,raw_score,score,percentile,range,ci_95,test,test_name,domain,subdomain,narrow,pass,verbal,timed,test_type,score_type,absort,description
Activation,9,56,75,WNL,50-62,brown_pr,Brown EF/A Parent-Report,Behavioral/Emotional/Social,ADHD/Executive Function (P),Arousal/Activation,,,,rating_scale,t_score,brown_pr_activation_1,"organizing, prioritizing, and activating to work (parent rated)"
Focus,14,62,87,Mildly Elevated,57-67,brown_pr,Brown EF/A Parent-Report,Behavioral/Emotional/Social,ADHD/Executive Function (P),Focused Attention,,,,rating_scale,t_score,brown_pr_focus_2,"focusing, sustaining, and shifting attention to tasks (parent rated)"
Effort,10,57,78,WNL,52-62,brown_pr,Brown EF/A Parent-Report,Behavioral/Emotional/Social,ADHD/Executive Function (P),Effort/Motivation,,,,rating_scale,t_score,brown_pr_effort_3,"regulating alertness, sustaining effort, and adjusting processing speed (parent rated)"
Emotion,16,68,94,Mildly Elevated,61-75,brown_pr,Brown EF/A Parent-Report,Behavioral/Emotional/Social,ADHD/Executive Function (P),Emotion Regulation,,,,rating_scale,t_score,brown_pr_emotion_4,managing frustration and modulating emotions (parent rated)
Memory,11,59,84,WNL,54-64,brown_pr,Brown EF/A Parent-Report,Behavioral/Emotional/Social,ADHD/Executive Function (P),Working Memory/Recall,,,,rating_scale,t_score,brown_pr_memory_5,utilizing working memory and accessing recall (parent rated)
Action,11,55,71,WNL,50-60,brown_pr,Brown EF/A Parent-Report,Behavioral/Emotional/Social,ADHD/Executive Function (P),Self-Regulation,,,,rating_scale,t_score,brown_pr_action_6,monitoring and self-regulating action (parent rated)
Total Composite,71,60,84,Mildly Elevated,57-63,brown_pr,Brown EF/A Parent-Report,Behavioral/Emotional/Social,ADHD/Executive Function (P),General Executive Dysfunction,,,,rating_scale,t_score,brown_pr_total composite_7,general executive functioning in daily life (parent rated)